{"algorithm":"trip-v1","algorithm_config_version":"0000000000000000","confidence":0.5,"ended_at":"2026-01-01T00:10:00Z","evidence_ids":["obs_00000000000000000000000000000000"],"privacy_class":"restricted","processed_at":"2026-01-01T00:10:01Z","schema_version":"1","source_digests":["0000000000000000000000000000000000000000000000000000000000000000"],"started_at":"2026-01-01T00:00:00Z","status":"confirmed","subject_id":"sub_00000000","superseded_by":null,"trip_id":"trip_00000000000000000000000000000000"}
